{
  "$schema": "https://json-schema.org/draft/2020-12/schema",
  "$id": "https://slay-slayer/game_iso_v1/env_asset.schema.json",
  "title": "env_asset_v1 — world-scenery delivery contract (FLAT)",
  "description": "The trimmed delivery front door for WORLD SCENERY. The character external_asset_v2 contract MINUS the hard parts (no rig, no animation/combat clips, no archetype, no calibration gate) PLUS what scenery needs: a `kind`, a `collision` block (= an ADR-019 collider), terrain `tiling`. TWO SOURCE SHAPES: terrain + water are TEXTURE assets (a seamless square ground/water texture warped to the 2:1 diamond by bake_terrain -- no mesh, no Blender, ADR-0006/0053); prop + blocking_feature are MESH assets (a 3D glb baked to a 16-dir iso sprite + hitmask, static). FLAT-only: walkable height-TIERS are a reserved extension (`tier`, off in v1; ADR-0039). Baked through the SHARED core read-only; env runs its own gate (build_env.py), never the character 42-gate.",
  "type": "object",
  "additionalProperties": false,
  "required": ["env_contract_version", "variant_id", "kind", "texture_mode"],
  "properties": {
    "env_contract_version": { "const": "env_asset_v1" },
    "variant_id": { "type": "string", "description": "unique id, e.g. ground_arid_v1 / boulder_red_v1 / mesa_wall_v1 / seep_pool_v1." },
    "kind": {
      "enum": ["terrain", "prop", "blocking_feature", "water"],
      "description": "terrain = flat walkable ground tile (TEXTURE warp; variant_class:terrain, dir 1; no collider, no world_metrics). water = flat tile (TEXTURE warp) + a sight-AND-movement-blocking collider (ADR-055). prop = static scenery (MESH; 16-dir sprite + world_metrics; usually non-blocking). blocking_feature = mesa/cliff/boulder/wall (MESH; static sprite + hitmask + a SOLID collider, ADR-054)."
    },
    "texture_mode": { "enum": ["flat_region", "textured"], "description": "flat_region = material base colours (mesh assets only); textured = real painted albedo. Terrain/water are always 'textured' (their base_color IS the source)." },
    "files": {
      "type": "object",
      "additionalProperties": false,
      "description": "MESH assets (prop, blocking_feature) require files.mesh. Texture assets (terrain, water) have NO mesh -- their source is textures.base_color.",
      "properties": {
        "mesh": { "type": "string", "description": ".glb (preferred) or .obj relative to this manifest. STATIC in v1 (no rig). prop/blocking_feature only." },
        "hitbox": { "type": "string", "description": "optional region_hitboxes sidecar (rarely needed for scenery -- a feature's collider is the `collision` block, not body regions)." }
      }
    },
    "textures": {
      "type": "object",
      "additionalProperties": false,
      "description": "named texture maps relative to this manifest. For terrain/water, base_color is the SEAMLESS SQUARE SOURCE warped to the diamond.",
      "properties": {
        "base_color": { "type": "string" },
        "normal": { "type": "string" },
        "roughness": { "type": "string" },
        "metallic": { "type": "string" },
        "real_albedo": { "type": "boolean" }
      }
    },
    "geometry": {
      "type": "object",
      "additionalProperties": false,
      "properties": {
        "up": { "enum": ["y", "z"], "default": "z" },
        "forward": { "enum": ["+x", "-x", "+y", "-y"], "default": "+x" },
        "unit": { "const": "meter" }
      }
    },
    "region_source": { "enum": ["material_name", "explicit_region_hitboxes"] },
    "direction_count": { "enum": [1, 16], "description": "1 for a terrain/water tile or a radially-symmetric prop; 16 for a directional prop/feature." },
    "world_metrics": {
      "type": "object",
      "additionalProperties": false,
      "required": ["height_world", "footprint_radius_world"],
      "description": "REQUIRED for prop + blocking_feature (drives occlusion sort + placement + the collider span). OMITTED for terrain + water.",
      "properties": {
        "height_world": { "type": "number", "exclusiveMinimum": 0 },
        "footprint_radius_world": { "type": "number", "exclusiveMinimum": 0 }
      }
    },
    "tiling": {
      "type": "object",
      "additionalProperties": false,
      "description": "terrain/water only. seamless = the tile repeats edge-to-edge with no visible seam (the env gate verifies via the 3x3 tiling preview + an edge-wrap check).",
      "properties": { "seamless": { "type": "boolean", "default": true } }
    },
    "collision": {
      "type": "object",
      "additionalProperties": false,
      "description": "An ADR-019 static collider (ADR-054). REQUIRED for blocking_feature + water; OPTIONAL for prop (default: non-blocking); FORBIDDEN for terrain (walkable). A cliff/mesa is a 2D footprint + a TALL occluder, never elevation (ADR-022).",
      "required": ["footprint", "blocks_movement", "blocks_vision"],
      "properties": {
        "footprint": {
          "type": "object",
          "additionalProperties": false,
          "required": ["shape"],
          "properties": {
            "shape": { "enum": ["circle", "aabb", "hitmask"] },
            "radius_world": { "type": "number", "exclusiveMinimum": 0 },
            "half_extents_world": { "type": "array", "items": { "type": "number", "exclusiveMinimum": 0 }, "minItems": 2, "maxItems": 2 }
          }
        },
        "occluder_height_world": { "type": "number", "exclusiveMinimum": 0, "description": "VerticalSpan top (m) the LOS uses (ADR-033). Water: the occluder BAND height that blocks sight across the wash; mesa/wall: the visual height." },
        "blocks_movement": { "type": "boolean" },
        "blocks_vision": { "type": "boolean" }
      }
    },
    "tier": {
      "type": "object",
      "description": "RESERVED -- walkable height-tiers (ADR-0039; the tiered-terrain bake contract + engine multi-level ADR). NOT VALID in env_asset_v1 (FLAT). env_asset_v2 adds edge_kind (flat_top|cliff_face|ramp|stair) + tier_height_world + orientation.",
      "additionalProperties": false,
      "properties": {}
    },
    "notes": { "type": "string" }
  },
  "allOf": [
    { "if": { "properties": { "kind": { "const": "terrain" } } },
      "then": { "required": ["textures"], "properties": { "textures": { "required": ["base_color"] } },
                "not": { "anyOf": [ { "required": ["collision"] }, { "required": ["world_metrics"] }, { "required": ["files"] } ] } } },
    { "if": { "properties": { "kind": { "const": "water" } } },
      "then": { "required": ["textures", "collision"], "properties": { "textures": { "required": ["base_color"] } },
                "not": { "anyOf": [ { "required": ["world_metrics"] }, { "required": ["files"] } ] } } },
    { "if": { "properties": { "kind": { "const": "prop" } } },
      "then": { "required": ["files", "world_metrics"], "properties": { "files": { "required": ["mesh"] } } } },
    { "if": { "properties": { "kind": { "const": "blocking_feature" } } },
      "then": { "required": ["files", "world_metrics", "collision"], "properties": { "files": { "required": ["mesh"] } } } },
    { "not": { "anyOf": [ { "required": ["rig"] }, { "required": ["animations"] }, { "required": ["archetype"] }, { "required": ["calibration"] } ],
      "$comment": "trimmed: scenery is static + has no archetype/rig/clips/calibration in v1" } }
  ]
}
