{
  "env_contract_version": "env_asset_v1",
  "variant_id": "seep_pool_v1",
  "kind": "water",
  "texture_mode": "textured",
  "files": {
    "mesh": "seep_pool_v1.glb"
  },
  "geometry": {
    "up": "z",
    "forward": "+x",
    "unit": "meter"
  },
  "textures": {
    "base_color": "seep_pool_v1_basecolor.png"
  },
  "direction_count": 1,
  "tiling": {
    "seamless": true
  },
  "collision": {
    "footprint": {
      "shape": "aabb",
      "half_extents_world": [
        0.5,
        0.5
      ]
    },
    "occluder_height_world": 0.6,
    "blocks_movement": true,
    "blocks_vision": true
  },
  "notes": "A water tile (dry-wash seep): impassable + sight-blocking via an occluder band (ADR-055); rendered flat like terrain."
}